userName,score,at,content
Pengguna Google,1,2025-01-21 13:38:40,"Ini saya mau daftar kok gak bisa bisa ya ,gak ada fiturnya gak jelas, saya mau daftar malah minta nomor efin saya kan mau daftar bukan login gimana sih minta nomor efin malah kekantor terus ngapain buat online"
Pengguna Google,4,2025-01-21 12:57:53,Aneh... tampilan kartu npwp di web dan aplikasi beda. Diweb nmr krtu 15 dan 16 digit. Diaplikasi hanya 15 digit
Pengguna Google,5,2025-01-21 11:49:57,Mntap
Pengguna Google,2,2025-01-21 11:19:47,Chat live tapi ga bisa ngetik
Pengguna Google,1,2025-01-21 10:34:28,"Aplikasi sampah... Gak guna, aplikasi pemerintah rata rata seperti sampah hanya habisin dana tapi tidak berguna."
Pengguna Google,3,2025-01-21 10:08:23,selalu kesulitan utk melakukan pembayaran pajak bulanan.
Pengguna Google,1,2025-01-21 04:47:31,Gaada fitur lupa password? Fix dulu app nya baru pakai uang pajaknya
Pengguna Google,1,2025-01-21 04:10:06,dinas pajak bodokkkkk.....mau ngisi negara asal malah ga ada Indonesia
Pengguna Google,1,2025-01-20 16:56:04,PAJAK VIA ONLINE SEMAKIN RIBET
Pengguna Google,1,2025-01-20 13:01:14,"Aplikasi parah ni,.coba verifikasi EFIN aja gak bisa Nyesel saya download nya anying"
Pengguna Google,1,2025-01-20 12:06:43,Apk parah ga bermutu
Pengguna Google,3,2025-01-20 11:38:09,"Mau pasang listrik di Indonesia harus ada nidi , slo, siup dan nib, buat siup dan nib harus ada no npwp, giliran buat no npwp registrasi situs tidak ditemuakn, coretax. susah kalau urusan sama pemerintah, buat aturan tapi dipersulit sendiri. Kocakkk"
Pengguna Google,1,2025-01-20 10:29:04,Apk apaan si ini serba serbi eror!!
Pengguna Google,1,2025-01-20 07:56:09,Apakah ini real
Pengguna Google,1,2025-01-20 05:59:54,"Up date terus, sampai hp tdk kompatible"
Pengguna Google,5,2025-01-20 02:44:54,Sangat membantu
Pengguna Google,1,2025-01-20 00:26:34,"aplikasi ga guna kalau kurang menarik ga becus dan uji coba aja kayanya dan ga mampu bayar IT utk sistem onlinenya , saya pernah buat online sampe sekarang ga bisa npwp saya dan ga becus juga CS nya makan gaji buta"
Pengguna Google,1,2025-01-19 21:14:36,Ribettt
Pengguna Google,1,2025-01-19 16:53:27,Aplikasi Awikwok Lolot Cuih
Pengguna Google,1,2025-01-19 11:27:36,Dagang es teh ae udh nyusahin rakyat doang
Pengguna Google,1,2025-01-19 09:51:25,Aplikasi ini sangat tidak berguna. Meskipun sudah update tetap tidak berguna. Aplikasi ini Dibikin Cuma ngabisin anggaran.
Pengguna Google,3,2025-01-19 06:28:14,SygSyg r b asal Barbados rt rrrrd
Pengguna Google,1,2025-01-19 03:53:09,MAU URUS EFIN SURUH MASUKIN NPWP SEKARANG NPWP SAMA DENGAN NIK ( 16 DIGIT ) SEDANGKAN MAKSIMAL MASUKAN NPWP PADA KOLOM EFIN CUMA 15 DIGIT SAAATTT SAAATTTT
Pengguna Google,1,2025-01-19 01:41:21,"Aplikasi ribet , memaksa rakyat taat pajak tapi pelayanan menyulitkan . Apalagi para pekerja di lokasi pedalaman . Ngejar2 pajak mulu imbal baliknya minim"
Pengguna Google,1,2025-01-18 13:42:21,Mana tombol EFINnya? Gak profesional
Pengguna Google,1,2025-01-18 13:26:07,"Error, error, error, error, error, error Capek bet"
Pengguna Google,1,2025-01-18 09:51:47,Ni guna nya apk buat apa . Gx bsa login ke web . Tp d apk ni bsa . Tp gx bsa laporan spt pajak . Trus guna nya apa
Pengguna Google,1,2025-01-18 09:40:07,Gak guna
Pengguna Google,5,2025-01-17 23:11:32,Okk
Pengguna Google,5,2025-01-17 18:41:06,Oke
Pengguna Google,1,2025-01-17 16:58:22,"Username dan password salah wkwkk, eror."
Pengguna Google,5,2025-01-17 12:44:18,Cepat selesai
Pengguna Google,1,2025-01-17 08:59:06,"Aplikasi ga guna, cs selalu sibuk ga bisa di chat👎👎👎"
Pengguna Google,1,2025-01-17 08:28:07,Tiap mau login errornpwp1516 kenapa ya? Bug kah?
Pengguna Google,1,2025-01-17 06:18:12,App sangat buruk selalu error ketika login. Tolong la perbaiki agar kita bisa akses app dengan lebih mudah
Pengguna Google,5,2025-01-17 04:04:47,"Alhamdulillah sistemnya udah di update, tanya kode ifin langsung patass. Ok tingkatkan lagi untuk mempermudah masyarakat, untuk taat perpajakan"
Pengguna Google,1,2025-01-17 03:55:32,Apk apaan dahh lemot bgtttt
Pengguna Google,5,2025-01-17 02:56:20,Sangat bagus dan membantu
Pengguna Google,1,2025-01-17 01:35:50,"Sangat lemot,dan tidak ada tanggapan keluhan akan aplikasi,gini mau maju gimana,aplikasi sekelas pemerintahan dibikin gk niat sama sekali"
Pengguna Google,1,2025-01-17 01:27:07,"Sulit diakses, disaat butuh pembuatan npwp online buat kelengkapan administrasi malah tambah sulit. Setelah opsi pernyataan semua terisi. Akses di bagian no 7 loading lambat. Terakhir ulang lagi dari awal, dan tetap seperti itu. Mana pulsa terpotong terus tiap ngirim kode. Sekali pencet lama masuk. Gitu kedua kali pencet masuk bersamaan. Tolong sebelum menerapkan aplikasi ini di akses/coba dahulu oleh pihak pihak yang memahami. Dan memberi demo yanglebih bisa dimengerti oleh setiap kalangan."
Pengguna Google,1,2025-01-17 01:24:59,Ga bsa bikin ebil...trus kapan bsa bayar..krna denda mi
Pengguna Google,5,2025-01-16 14:10:56,Sangat membantu
Pengguna Google,1,2025-01-16 07:44:28,Tdk bisa kepake anjir 😌
Pengguna Google,5,2025-01-16 06:48:32,Top
Pengguna Google,1,2025-01-16 06:26:45,Live chat susah di akses. Registrasi susah sekali. Mau taat pajak aja susah.
Pengguna Google,4,2025-01-16 05:32:42,Good
Pengguna Google,1,2025-01-16 03:27:25,"Aplikasi nya sulit diakses, web nya pun gajelas gabisa akses terus, dan datang ke kantor pajak cimanggis depok pelayanan dari satpam nya gajelas juga, masa orang tanya malah ditanya balik gak kasih arahan sama sekali, udah mana cuek orangnya jawabnya juga sesuka hati dia aja"
Pengguna Google,1,2025-01-16 03:11:22,Pelayanan lama yang didulu orang terdekatnya sudah nunggu daritadi
Pengguna Google,1,2025-01-15 22:57:50,Eror
Pengguna Google,5,2025-01-15 14:28:01,MemudHkan segala urusan👍👍👍💪
Pengguna Google,1,2025-01-15 10:03:28,Aplikasi pemerintah kok lemot kek gini dan keseringan eror mohon di perbaiki trimakasi
Pengguna Google,1,2025-01-15 08:31:15,gak jelas
Pengguna Google,1,2025-01-15 07:59:48,"apakah nama djp disalah gunakan bt penipuan,krn sy di tlp pakai logo ini,ngaku vertivikasi data umkm, fan di arahkan dwld ini,dan sruh ok² di macam2 ,semoga pd hati2,dimintai data internal hp"
Pengguna Google,1,2025-01-15 07:03:54,"Apk ngga responsif,lemot,dan tidak membantu sama sekali lebih baik hapus Aplikasinya,karena tidak membantu sama sekali justru merugikan pengguna yang memakai,karena buang banyak waktu ,dan nihil hasilnya"
Pengguna Google,5,2025-01-15 06:58:33,bagus
Pengguna Google,1,2025-01-15 06:49:54,"Terimakasih, Kalau ada lagi menu EFIN nya, aku tambah lagi bintangnya"
Pengguna Google,1,2025-01-15 06:34:43,logot sendiri mending versi lama
Pengguna Google,1,2025-01-15 05:41:35,Sampah gbisa di gunakan buang waktu saja
Pengguna Google,1,2025-01-15 05:07:50,kenapa ya tidak bisa masuk sperti aplikasi tdk berfungsi saat ini
Pengguna Google,1,2025-01-15 04:12:11,login aja gabisa padahal udah dikasih surat penerbitan akun wajib pajak dari KPP
Pengguna Google,1,2025-01-15 04:03:43,kalau ada yang sulit kenapa cari yang mudah...
Pengguna Google,1,2025-01-15 04:01:14,"Biar bintang yg menilai,🤬"
Pengguna Google,5,2025-01-15 03:03:58,Susah belumbisa
Pengguna Google,1,2025-01-15 02:31:35,mau buat npwp saja di persulit coba daftar online eror mulu
Pengguna Google,1,2025-01-15 02:00:58,"Aplikasinya sangat lambat. Kita ajukan berulang kali untuk mendapatkan kode EFIN pun selalu saja gagal. Masukkan kode OTP yang dikirim oleh sistem pun dibilang ""SALAH"". Tolong diperbaiki aplikasinya. Jika tidak bisa digunakan, silahkan kunci saja aplikasinya."
Pengguna Google,1,2025-01-15 01:04:03,Tolong kalau kerja yang serius
Pengguna Google,2,2025-01-14 22:27:31,"Aplikasi tergaberguna asli udah di coba verifikasi email Ampe berhari hari tuh email kaga masuk masuk, sue bnget dah, ujung ujungnya malah harus Dateng ke KPP langsung akhh tolong dong yaa di tingkatkan lagi untuk masyarakat, katanya lebih mudah klo digital ini malah mempersulit, mau login ajh GK bisa bisa , gimana klo lagi keadaan terdesak"
Pengguna Google,1,2025-01-14 08:57:06,Aplikasi tolol d bikin g bisa login😁😁😁
Pengguna Google,1,2025-01-14 08:47:01,"u know laah, useless"
Pengguna Google,1,2025-01-14 07:42:58,"Kok tolol kali pengembang aplikasi ini, verifikasi nomor udah sesuai malah salah terus, apa sih, sesuai rating nya low, app ga di benerin, kerjanya apa sih"
Pengguna Google,1,2025-01-14 07:05:08,"Tidak ada menu ""Lapor"" SPT tahunaan ASN 1770s, kalau buka melaui broser baru ada."
Pengguna Google,1,2025-01-14 06:54:36,"Katanya suruh akses fitur live chat, pas udah di akses ga terhubung"". Uang pajak yg kita bayar dapetnya apk beginian?"
Pengguna Google,5,2025-01-14 05:27:47,Ok
Pengguna Google,1,2025-01-14 03:54:06,Aplikasi gak jelas.. Telp nomer cs sibuk terus..chat eror terus. Masuk aplikasi gak bisa reset passw..dr chrome bisa masih pake no effin.. Aplikasi buat mempermudah bukan malahan bikin emosi
Pengguna Google,5,2025-01-14 02:56:22,Mantap
Pengguna Google,1,2025-01-14 02:42:35,"gk guna, coretax eror trus ke kntor pajak katanya hrus onlen buat npwp."
Pengguna Google,1,2025-01-14 01:44:40,pakai aplikasi susah..ga bsa bikin ebil...ribet
Pengguna Google,1,2025-01-14 01:23:58,"Aplikasi yg tidak pantas untuk di kasih ranting.mau login susah,chat ke Cs sama susah,gimana mau laporan pajak kalo aplikasinya seperti ini, Menu LUPA PASSWORD juga gk ada👎👎👎👎👎👎"
Pengguna Google,1,2025-01-13 15:33:02,Saya berulang kali daftar ada aja kendalanya di aplikasi online ini. Tolong lebih ditingkatkan lagi
Pengguna Google,2,2025-01-13 13:21:21,"Makin sulit ,apliksiNya sering troble GK seperti yg dulu sangat di sayangKan"
Pengguna Google,1,2025-01-13 12:35:32,Tidak ada menu EFIN
Pengguna Google,1,2025-01-13 11:31:02,"Minta EFIN, eror mulu. Padahal udah benar informasinya, live chat ga pernah bisa. Padahal ga ad gangguan internet."
Pengguna Google,1,2025-01-13 08:22:36,Sekarang makin aneh aja gk jelas banget bgbug nyah semenjak pembaruan sistem bikin orang orang pusing jelek banget apak nayh
Pengguna Google,1,2025-01-13 08:13:47,PAYAH
Pengguna Google,5,2025-01-13 07:53:19,Ok
Pengguna Google,1,2025-01-13 06:48:28,"kalo belum siap aplikasiinya jangan apa"" online sekarangg yahhh mau laporan pajak aja susah banget secara onlinee klo belum ready ngapain wajib lapor lewat aplikasi"
Pengguna Google,1,2025-01-13 05:58:04,tidak bekerja dengan baik
Pengguna Google,1,2025-01-13 04:58:34,"Aplikasi yg seharus nya bagus kualitas nya untuk masyarakat malah eror semua,"
Pengguna Google,2,2025-01-13 04:32:55,Maaf nih kenapa yah waktu pengajuan efin di saat verifikasi kode yg di kirim via sms atau email selalu salah terus padahal bener kok kode verifikasinya. Tolong di perbaiki lagi apk nya
Pengguna Google,1,2025-01-13 04:14:39,Gak guna
Pengguna Google,1,2025-01-13 04:08:04,Aplikasi busuk gini ngabisin anggaran negara aja !!! Pelayanan kek kadal
Pengguna Google,1,2025-01-13 02:57:32,"Aplikasi tolol ,it nya suruh belajar lagi"
Pengguna Google,1,2025-01-13 02:20:30,Aksesnya lemot bgt
Pengguna Google,1,2025-01-13 01:32:24,"Aplikasi sampah, kantor pajak kerjanya lambat, kita harus tunggu sampai sore, taiii"
Pengguna Google,5,2025-01-12 15:47:41,Ok
Pengguna Google,1,2025-01-12 13:11:15,ampas
Pengguna Google,1,2025-01-12 10:43:03,Pada ga becus bikin apk!!! SELAMAT sudah menjadi aplikasi pemerintah yang tidak berguna!
Pengguna Google,1,2025-01-12 10:32:21,HAMA HAMA HAMAAAAAAAAAA
Pengguna Google,1,2025-01-12 08:59:03,Aplikasi ampas daftar npwp aja dipersulit. Bisa nya cepet klo pake CALO
Pengguna Google,1,2025-01-12 00:21:23,Aplikasi gak guna
Pengguna Google,5,2025-01-11 16:56:18,xml dan jdon fi perbaiki
Pengguna Google,1,2025-01-11 14:54:57,Penipuan
Pengguna Google,5,2025-01-11 14:34:06,Good apk
Pengguna Google,1,2025-01-11 09:31:00,"Lapor pajak sangat sulit, panduan jelek, tidak ada kurikulum literasi pajak di sekolah. Makasih sudah buat frustasi."
Pengguna Google,1,2025-01-11 09:07:35,Live chat kagak pernah bisa. Di aplikasi maupun website. Buat apa bikin aplikasi kalo gak guna!
Pengguna Google,5,2025-01-11 08:19:34,Ok
Pengguna Google,1,2025-01-11 06:34:35,sampah
Pengguna Google,1,2025-01-11 05:43:11,"Menu Efin nya ga muncul min, perbaikin dong"
Pengguna Google,1,2025-01-11 04:23:03,Tidak membantu sama sekali. Gitu aja udah.
Pengguna Google,1,2025-01-11 02:03:22,"full bug , APK gajelas ."
Pengguna Google,1,2025-01-10 16:46:32,"Kecewa kok 2025 makin sulit untuk mengurus kartu NPWP dan efin,, Padahal mau bayar pajak kok di persulit"
Pengguna Google,1,2025-01-10 16:01:28,"Barusan kena phising dari aplikasi ini Gaes. 43 jt ilang.. Awalnya ditelpon ,wa , di pandu kmudian vidcall utk penonaktifan NPWP scr online. Dipandu tata cara download, dari playstore Ges, bukan apk ,g nyuruh transfer, g minta pin dsb ... alus banget mainnya...benar benar kyk film film...ya Allah.. Masuknya melalui pajak.urdin .ac Hati hati"
Pengguna Google,1,2025-01-10 15:41:36,Guoblooog app
Pengguna Google,1,2025-01-10 15:39:18,Menu E-FIN yang sebelumnya ada sekarang hilang entah kemana😓
Pengguna Google,1,2025-01-10 13:46:08,Menu lupa efin tidak ada.....kadang sistem pajak ini masih sangat kurang dalam fasilitasi masyarakat
Pengguna Google,1,2025-01-10 13:23:15,Gini amat aplikasi pemerintah hdeuh emil sudah bener tapi ngebug nungguin verivikasi ampe berhari hari belum juga ada
Pengguna Google,1,2025-01-10 10:54:57,Ini menu laporannya mana ya? Ga jelas banget aplikasinya
Pengguna Google,1,2025-01-10 07:48:56,apk ga guna
Pengguna Google,1,2025-01-10 06:08:53,"Live chat parah, Pendapatan banyak sistem gak canggih."
Pengguna Google,1,2025-01-10 06:07:12,enggh bisa login dari aplikasi M- Pajak Tetepi bisa login dari browser .... Adeh gawat aplikasi ini
Pengguna Google,1,2025-01-10 05:46:30,"Aplikasi Gak Tidak Berguna, Bodoh."
Pengguna Google,1,2025-01-10 04:11:02,ga guna aplikasi sampah
Pengguna Google,1,2025-01-10 03:32:06,Saya tidak masuk ke aplikasi .. password salah terus.ada solusi
Pengguna Google,1,2025-01-10 03:03:47,aplikasi gajelas!!!
Pengguna Google,1,2025-01-09 23:45:30,Sudah ku duga dari aplikasi pemerintah.. gk guna banyan masalah dan bug nya ... Yg lebih jengkelnya lagi situs nya lelet sekali ..
Pengguna Google,1,2025-01-09 23:04:51,"Apk sampah,gak bantu banget,,,apk sekelas pemerintah kalah sama apk Hugo, Indo indo"
Pengguna Google,1,2025-01-09 15:54:19,2025 apakah efin sudah tidak berlaku
Pengguna Google,1,2025-01-09 15:05:34,"Tolong di tingkatkan lagi, aplikasi GK bisa di akses"
Pengguna Google,1,2025-01-09 14:29:13,App jelek banget fitur minim banyak bug
Pengguna Google,1,2025-01-09 14:05:10,"Menu effin malah di hapus bikin ribet, niat daftar online biar gak ribet tapi malah di bikin ribet"
Pengguna Google,1,2025-01-09 13:42:02,Percuma pake aplikasi kalo GK bisa daftar lewat aplikasi
Pengguna Google,1,2025-01-09 13:37:12,"Pendaftaran lewat coretax ribet ,, tidak ada panduan ,, pengisian terlalu sulit untuk menarik map ,, detail alamat juga susah di masukan ,, padahal semua sudah di isi sesuai data ,,tolong admin di tinjau"
Pengguna Google,1,2025-01-09 12:12:07,Aplikasi ngaco..gak ada gunanya...gimana Indonesia mau maju klau aplikasi begini...di suruh login dulu.tapi menu untuk buat akun ajaa gak ada...Berharap dii permudah..tapi tambah sulit..
Pengguna Google,1,2025-01-09 09:38:43,Aplikasi apassssas
Pengguna Google,2,2025-01-09 09:30:03,Cara Ubah Data Gimana
Pengguna Google,1,2025-01-09 09:24:55,aplikasi sering ke log out sendiri akunnya. diharapkan bisa diperbaiki
Pengguna Google,1,2025-01-09 06:18:27,Aplikasi aneh masa iya lain ada icon EFIN di aplikasi nya gua kg ada aneh bet rugi download2 buang2 kuota
Pengguna Google,1,2025-01-09 06:09:45,"Kantor pajak jakarta timur darah pasar rebo mau bikin NPWP aja dipersulit berbelit belit maksudnya apa coba udh 4 hari bikin NPWP aja sampe hari ini blm selesai, harus pake sogokan kah? Biar ga dipersulit heran?"
Pengguna Google,1,2025-01-09 05:46:57,Buruk sekali
Pengguna Google,1,2025-01-09 04:52:23,Aplikasi sampah. Server cacat
Pengguna Google,1,2025-01-09 04:10:02,Kembalikan kayak dulu
Pengguna Google,1,2025-01-09 03:45:34,"Aplikasi busuk, cuma bikin habis anggaran saja. Orang mo daftar harus pake efin, orang lupa kata sandi harus pake efin. Giliran mo buat efin juga di persusah, niat buat aplikasi supaya mempermudah malah bikin susah saja"
Pengguna Google,1,2025-01-09 01:03:08,Masa pengajuan lupa EVIN ngga bisa padahal sudah ngisi data sesuai yang di minta .. Tinggal tahap terahir ngga bisa di pencet si
Pengguna Google,1,2025-01-08 16:57:57,Aplikasi ga jelas! Apa apa aplikasi dari pemerintah ga ada yg jelas. Negara cuman buaat mainan!
Pengguna Google,1,2025-01-08 14:26:55,"Udah bener kemaren mau ngurus npwp gampang, cek NPWP juga mudah, sekarang malah dipersulit, gimana kerja kalian ini"
Pengguna Google,1,2025-01-08 14:15:13,Sekelas pajak lohh... Masa apk nya gak jelas ginii busett...gk normal
Pengguna Google,5,2025-01-08 14:13:40,Sangat membantu
Pengguna Google,1,2025-01-08 13:46:02,"BUAT APLIKASINYA AJA TOLONG DANA NYA KAN BANYAK YAH, BIKIN YG PROPER GITU JGN MENYULITKAN. Mau bayar pajak ni, nnti kalo gak bayar pajak kena marah, mau bayar sulit pendaftaran dll nya 🤣"
Pengguna Google,1,2025-01-08 11:17:49,Gak bisa dipake
Pengguna Google,2,2025-01-08 09:35:19,"Mau aplikasi, situs web, atau instansi lainnya yang berhubungan dengan pemerintahan 1. situs lemot, lama terbuka walau pakai jaringan wifi kuat, 2. cs/pengaduan/chat/gmail semuanya lemot balasnya kayak gak ada orang sama sekali, dari kedua point itu ajah sudah bisa menyimpulkan ya? Seberapa buruknya aplikasi/sistem web pemerintahan"
Pengguna Google,1,2025-01-08 09:35:00,Aplikasi tak berguna...hapus saja dari google sampah
Pengguna Google,1,2025-01-08 09:13:47,Susah di gunakan ga bermanfaat masuk ke live chat ja susah muter terus
Pengguna Google,1,2025-01-08 09:09:21,Sangat tidak membantu
Pengguna Google,1,2025-01-08 08:42:27,gaguna
Pengguna Google,1,2025-01-08 05:13:44,"Aplikasi useles, niat melayani tidak anda2 ini!!!!"
Pengguna Google,2,2025-01-08 05:12:52,Setiap mau masuk chat live aja terkendala error tolong diperbaiki adanya aplikasih m pajak buat mempermudah malah aplikasinya sering erro
Pengguna Google,1,2025-01-08 02:18:11,G bisa dipakai
Pengguna Google,1,2025-01-07 14:39:38,Jelek sangat. Tambah aplikasi ga ada cek NPWP. Web nya pun begitu
Pengguna Google,1,2025-01-07 13:21:31,Aplikasi tolol.gimana mau bayar pajak
Pengguna Google,1,2025-01-07 12:45:15,Bintang aja yg nilai
Pengguna Google,1,2025-01-07 12:06:57,lag mulu
Pengguna Google,1,2025-01-07 11:52:51,"Orang pajak bikin aplikasi gak becus , suruh bayar pajak tapi aplikasi dan website resmi bobrok"
Pengguna Google,1,2025-01-07 11:15:57,"Aplikasi ga jelas, situs web juga lemot. Pake wifi pake data juga sama aja. Halahhhh bilang aja kalo gabisa online harus ke kantor pajak"
Pengguna Google,1,2025-01-07 10:54:42,Mempersulit
Pengguna Google,1,2025-01-07 09:59:51,"Kalo ada rating bintang 0 akan saya pilih rating itu krn anda layak dapat 0..ga malah makin baik makin parah..verifikasi terus menerus,"
Pengguna Google,3,2025-01-07 07:29:53,Kok ga ada fitur efin nya yaa
Pengguna Google,1,2025-01-07 07:26:10,Coretax bikin pusing
Pengguna Google,1,2025-01-07 05:21:47,Ini badan milik negara. Tapi jelek sekali aplikasinya. Login susah daftar susah. . Uang negara kemana ?? Masa kalah dengan aplikasi buatan anak anak SMK.
Pengguna Google,1,2025-01-07 05:07:21,"Niat gk lu bikin situs,suka eror aja bgst"
Pengguna Google,1,2025-01-07 04:34:09,"Aplikasi anjayyy bgttt. Ngebug parah😭. Ini gimana mau laporan SPT kalau nomor efin aja susahnya mintak ampun. Tolonglah,ini aplikasi kan dibuat permudah untuk masyarakat kenapa lama banget sih.sudah klik meminta permohonan malah balik ke tampilan awal.padahal pake data.sudah pake wifi gabisa bisa. Aplikasi yg jelas dikit dong kalau buat😭🫵"
Pengguna Google,1,2025-01-07 04:01:07,"Tidak bisa digunakan, log in selalu error"
Pengguna Google,1,2025-01-07 03:39:25,uang buat web dan aplikasi terlalu banyak dikorupsi ya gini jadinya
Pengguna Google,1,2025-01-07 02:40:03,"Gk jelas, login kg bisa², udah tau mau buat NPWP"
Pengguna Google,3,2025-01-07 02:29:39,Saya mu bikin NPWP susah g d respon
Pengguna Google,1,2025-01-07 02:06:25,"Seharusnya aplikasi ini mendapatkan bintang setengah, minimal kasih fasilitas pembuatan NPWP-nya dj aplikasi ini. Secara logika bagaimana caranya orang masuk kalau belum daftar. Rakyat dipaksa bayar pajak tetapi aplikasi pajaknya bermasalah"
Pengguna Google,1,2025-01-07 02:02:15,"Aplikasi sampah buang"" anggaran ajaa ga guna!"
Pengguna Google,1,2025-01-07 01:23:12,"Mau minta kode efin gak bisa Mulu , mau aplikasi atau web sama² eror"
Pengguna Google,1,2025-01-07 00:34:28,Sangattttt mengecewakan Dan gak guna juga sih aplikasi ny
Pengguna Google,5,2025-01-06 23:47:54,membantu
Pengguna Google,1,2025-01-06 16:03:58,"aplikasi gak guna.. Error terus,,, pake duit rakyat doang bisa nya.. 👎"
Pengguna Google,1,2025-01-06 14:56:53,Saya sudah membuat akun lewat web tp kenapa tidak bisa login lewat apk????!!!! Sungguh mengecewakan!!
Pengguna Google,1,2025-01-06 08:44:12,"Aplikasi bangke, susah buat akses live chat juga, najis"
Pengguna Google,1,2025-01-06 07:08:59,"Ini gimna cara bikin NPWP online, web bermasalah terus"
Pengguna Google,1,2025-01-06 04:16:23,"Anggaran gede aplikasi busuk, Kata2 mutiara ""sinyal harus Kuat ya"","
Pengguna Google,1,2025-01-06 03:54:13,"Aplikasi GAGUNA!!! Mau registrasi aja ngga bisa, muter"" mulu.. yang ada bikin bingung"
Pengguna Google,2,2025-01-06 02:23:08,"Gak guna,"
Pengguna Google,1,2025-01-06 01:02:56,"BUAT NPWP SEMAKIN SULIT VALIDASI FOTO NGA GAGAL TERUS,. NGAPAIN DI UBAH UBAH SEBELUMNYA SUDAH BAGUS,. JANGAN TOLOL"
Pengguna Google,1,2025-01-05 16:56:49,ribet bgt mending g usah didownload
Pengguna Google,5,2025-01-05 09:31:00,👍👍👍
Pengguna Google,1,2025-01-05 09:24:20,Paling males punya urusan sama negara
Pengguna Google,1,2025-01-05 08:55:11,ga jelass
Pengguna Google,5,2025-01-04 14:20:56,Aplikasi yg bagus sangat membantu.. Semoga sukses selalu bintang 5
Pengguna Google,5,2025-01-04 13:33:20,Oke
Pengguna Google,1,2025-01-04 12:45:29,Ga bisa diakses sama sekali
Pengguna Google,3,2025-01-04 07:02:11,Maaf tolong direspon kak untuk aduan saya
Pengguna Google,1,2025-01-04 03:27:39,Tidak jadi bikin NPWP
Pengguna Google,5,2025-01-04 02:10:27,Ok 👍
Pengguna Google,1,2025-01-03 17:54:01,"Belum juga setahun NPWP udah ga aktif, gmna si"
Pengguna Google,1,2025-01-03 16:15:14,Payah
Pengguna Google,1,2025-01-03 15:11:25,"Ini kenapa gak ada fitur efinn? Padahal saya liat di yutub ada fitur efin, giliran saya download malah gak ada."
Pengguna Google,1,2025-01-03 13:29:48,Jelek bgt! Mau daftar di tempat selalu di arahkan ke online. Giliran pakai online webnya sering eror. Ga malah mempermudah malah menyusahkan. Saya sampai habis pulsa 15k lebih buat kirim kode verifikasi yg sering eror. !!!
Pengguna Google,5,2025-01-03 11:15:54,Mantap
Pengguna Google,1,2025-01-03 11:02:57,Web nya ngaco.. banyak bug tp dh buat pemakaian publik.. di coba dulu lah di berbagai browser minimal.. masukin kode verifikasi sama otp aj gk bs.. kadang malah gk bs buat ngirim kode verifikasi..
Pengguna Google,3,2025-01-03 09:14:37,gmn cara buat spt tahunan?
Pengguna Google,1,2025-01-03 08:33:13,Lemot
Pengguna Google,1,2025-01-03 08:26:25,Apk nyusahin
Pengguna Google,5,2025-01-03 07:54:29,tambah mudah aman
Pengguna Google,1,2025-01-03 07:43:44,Baik website dan aplikasi semua masih jauh dari harapan
Pengguna Google,1,2025-01-03 07:42:10,Wah parah aplikasinya
Pengguna Google,1,2025-01-03 06:40:21,Tolong segera perbaiki.. serasa gak aplikasi gak ada gunanya.. apa lg live chatnya
Pengguna Google,2,2025-01-03 06:13:31,Ada aplikasi harusnya bisa daftar via aplikasi malah ngga bisa aplikasi cuman buat login aja. Bukan tambah gampang malah tambah ribet
Pengguna Google,1,2025-01-03 05:23:23,"(SEMUA) Yg berhubungan dg pemerintah koq ga pernah beres dlm jangka wkt lama. Ga yakin Indo bs jd negara maju, mgkn smpe kiamat jg ga prnh bs."
Pengguna Google,5,2025-01-03 05:10:57,DJP memang yang terbaik
Pengguna Google,1,2025-01-03 03:12:30,"Gak guna, kalo. Mau buat aplikasi yg niat, bisa mempermudah aksesnya untuk login dan lain sebaginya, apk dan link sama saja susah untuk diakses"
Pengguna Google,1,2025-01-03 02:25:38,Apk Lol
Pengguna Google,1,2025-01-03 02:04:43,Sekiranya tim IT blm sanggup launching apps. Kaga usah di publish. Nyusahin
Pengguna Google,2,2025-01-03 01:59:57,"Tolong apknya di benahi dong, masa eror terus"
Pengguna Google,1,2025-01-02 17:43:15,Npwp untuk daftar online tidak bisa di gunakan
Pengguna Google,1,2025-01-02 11:12:53,Gak gunaa buat apk tololl bgt
Pengguna Google,1,2025-01-02 09:07:29,Apk busuk jangan didonlot
Pengguna Google,1,2025-01-02 07:02:23,Parah... mending di hapus saja
Pengguna Google,1,2025-01-02 04:42:59,Ga guna
Pengguna Google,1,2025-01-02 03:23:09,Parah banget ini aplikasi.. Memalukan
Pengguna Google,1,2025-01-01 23:26:08,Kayak aplikasi buatan Hacker yang di desain buat ngambil data diri kalian. Ndak berguna.
Pengguna Google,1,2025-01-01 13:13:11,Ini appl apa sih ko percuma
Pengguna Google,1,2025-01-01 13:02:11,Apk tidak berguna Tidak bisa di akses
Pengguna Google,1,2025-01-01 12:43:47,"Apk eror terus gimana pemerintah ini sih, kok tidak konsisten"
Pengguna Google,1,2025-01-01 10:18:49,"Gak guna,lelet, sama sesekali aplikasi tidak embantu"
Pengguna Google,1,2025-01-01 10:14:38,Segala macem aplikasi pemerintah pasti kek gini..
Pengguna Google,2,2025-01-01 03:41:07,"lemott banget, servernya ampas. semoga dev IT nya dari orang yg berpengalaman, dan digaji layak. tapi dev IT juga harus kerja yang bener."
Pengguna Google,1,2025-01-01 03:23:58,Susah......loding terus....
Pengguna Google,1,2024-12-31 23:49:39,Pasti yang membuat aplikasi ini orang nya pakai kacamata punya sifat pelit tidak suka membantu dan kalau sudah tua sering sakit-sakitan menderita aplikasi gak guna sulit login mutar2 terus.
