userName,score,at,content
Pengguna Google,1,2024-01-12 14:46:44,"Nomor dan paswod NPWP sudah bner tapi ga bisa login, sampai di ulang skian kali pun ga bisa.. Haduuuuu.."
Pengguna Google,1,2024-01-12 11:47:54,mau lapor pajak aja ko ribet amat
Pengguna Google,1,2024-01-12 02:39:49,"Minta kode efin saja ribetnya minta ampun, mau reset password juga ribet kali.."
Pengguna Google,3,2024-01-12 01:34:11,"Assalamualaikum... Kalau mau ganti nomor kontak gimana caranya? Soalnya kode verifikasi efin ternyata dikirim ke nomor kontak yang lama, terima kasih."
Pengguna Google,1,2024-01-11 10:00:00,"Validasi otp dari zaman dinasti ming sampai skrng ndk masuk2 ke sms,,gmna mah daftar"
Pengguna Google,1,2024-01-11 07:46:08,"Aplikasi membingungkan, msih banyak error,"
Pengguna Google,1,2024-01-11 06:39:13,"Aplikasi buruk warga diminta tertip tapi aplikasi layanan publik seburuk ini, loginnya susah"
Pengguna Google,1,2024-01-11 06:32:31,Gk ada guna aplikasiny
Pengguna Google,1,2024-01-11 05:05:17,kenapa saat memasukkan no nik cuma dibatasi 15 digit? Alhasil tidak bisa login Segera perbaiki
Pengguna Google,5,2024-01-11 03:54:18,Sangat membantu 🙏
Pengguna Google,1,2024-01-11 01:55:43,Aplikasi nya jelek tidak bisa login ribet ga mudah di akses
Pengguna Google,5,2024-01-11 01:43:53,Memudahkan dalam pelaporan SPT tahunan
Pengguna Google,5,2024-01-11 00:49:23,"Buat yang kemarin kemarin kecewa sama aplikasi ini, sekarang sudah beda ya, sat set cepat dan mudah sekali dalam penggunaan nya, mantap djp dan tim IT nya"
Pengguna Google,5,2024-01-10 18:10:19,Sangat membantu sekali
Pengguna Google,4,2024-01-10 13:06:32,lupa pasword dan efin gimana ya...
Pengguna Google,1,2024-01-10 10:20:41,Susah kelek aplikasinya
Pengguna Google,1,2024-01-10 07:36:21,Gk bisa d gunain
Pengguna Google,1,2024-01-10 05:10:13,Aplikasi gak jelasss input NIK kok kuarang 1
Pengguna Google,1,2024-01-10 02:25:56,Pantesan gagal terus ternyata emang dari awal udah tidak bersedia untuk melayani
Pengguna Google,3,2024-01-09 15:35:31,Bagus
Pengguna Google,1,2024-01-09 15:13:14,Noob
Pengguna Google,1,2024-01-09 10:31:23,Aplikasi ga jelas. Sekalian orang mau lapor pajak masuk nya susah... Gaguna
Pengguna Google,1,2024-01-09 08:32:09,"Aplikasi taiiii,,,brengseekk"
Pengguna Google,5,2024-01-09 08:29:10,Terima kasih atas aplikasi M-Pajak ini karena sangat membantu dam mempermudah dalam membayar pajak
Pengguna Google,1,2024-01-09 04:28:40,"Hapus aja aplikasi ini, buka ngk bisa forceclose terus"
Pengguna Google,5,2024-01-09 04:21:26,"Gagal mengirim data, padahal data sudah benar, tolong di perbaiki lagi"
Pengguna Google,4,2024-01-09 04:18:09,Good
Pengguna Google,3,2024-01-09 00:27:39,Itu login nya di perbaiki.. Ya tidak bisa masuk wong mau kasih masuk nomer NIK hilang satu angkanya. Mau diketik tambahin angka tidak bisa
Pengguna Google,5,2024-01-09 00:01:18,Good
Pengguna Google,1,2024-01-08 17:28:25,"Sumpah ini aplikasi pajangan aja , daftarin pakai email tulisannya email sudah terpakai, padahal di check blm terdaftar .coba siapa yg sukses daftar pakai aplikasi ini"
Pengguna Google,3,2024-01-08 10:54:30,Kenapa login pakai NIK kok tidak bisa/ ketersediaan untuk menulis NIK kurang
Pengguna Google,2,2024-01-08 09:54:13,"Di web bisa login di aplikasi tidak bisa,tolong diperbaiki. Padahal sudah saya update"
Pengguna Google,1,2024-01-08 08:03:48,"Aplikasi tidak bermanfaat, pas mau masukin NO NPWP malah ga cukup"
Pengguna Google,1,2024-01-08 07:36:45,Ini aplikasinya kenapa? kok tidak bisa buat akun
Pengguna Google,5,2024-01-08 07:21:23,Ok
Pengguna Google,1,2024-01-08 02:45:03,Aplikasi ga bisa digunakan
Pengguna Google,1,2024-01-08 02:43:25,"Aplikasi ga jelas, login aja susah"
Pengguna Google,1,2024-01-08 00:07:29,Gak jelas aplikasi nya gak bisa di pakai sama sekali
Pengguna Google,1,2024-01-07 11:16:37,Gk jelas ruwett awal masuk daftar pilihan gk bisa d buka
Pengguna Google,1,2024-01-07 10:11:44,"Fungsinya app ini apa,toh mau upload data pajak juga harus pake versi web"
Pengguna Google,1,2024-01-07 08:47:20,Tolong perbaiki! TIDAK BISA LOGIN!
Pengguna Google,1,2024-01-06 04:27:30,No recommendations
Pengguna Google,1,2024-01-05 09:57:37,"Gajelas banget, suruh masukin nomer kk, giliran di masukin slot nomernya kurang 1,,"
Pengguna Google,5,2024-01-05 07:00:52,Ok
Pengguna Google,1,2024-01-05 04:41:56,"Budget anggaran untuk maintenance aplikasinini gede banget tapi aplikasinya tidak berfungsi dengan baik, Kalau belum siap dengan layanan online jangan bikin aplikasi deh, hemat anggaran"
Pengguna Google,1,2024-01-05 04:22:12,"Error terus, sangat menyusahkan"
Pengguna Google,1,2024-01-05 03:21:36,Ngurus EFIN masih ERROR. Ini uang pajak bikin aplikasi gini aja cacat. Mau coba ngurus pajak malah begini ribetnya. Tolong pihak playstore hapus aja nih aplikasi.
Pengguna Google,1,2024-01-05 02:12:41,Parah Banget Aplikasinya Padahal Punya Pemerintah.Masuk Gagal Terus Padahal Udah Bener Loading Terus Ujung Ujungnya Malah Ke Blokir.Diulangi Sampe 3x dan 33nya Akunnya Ke Blokir.TOLONG DIPERBAIKI !! Baik di Website ataupun Aplikasi Tolong Diperbaiki Percuma Orang Mo Daftar Online Kalo Gak Bisa Di Akses
Pengguna Google,1,2024-01-04 09:27:04,"banyak yg harus di perbaiki ,ibarat nilai 0-10 gua kasi 0 BESAR ,LOGIN SAJA TIDA BISA ,bukannya nambah mudah malah RIBET ,tolong di tingkatkan lagi"
Pengguna Google,1,2024-01-04 05:32:50,"Login GK bisa.. GK di web atau di apk, sama saja.."
Pengguna Google,5,2024-01-04 03:20:37,baik aplikasi yang mudah di pahami dan membatu untuk menambah wawasan pengetahuan
Pengguna Google,1,2024-01-03 23:35:09,"Bodoh, aplikasi rusak, login ga bisa bisa, waktu pengajuan lupa efin data sudah benar malah gagal terus berkali kali, ini gimana ini bukannya mempermudah malah mempersulit, lagian ya.. pemadanan NPWP itu kan program pemerintah pusat harusnya ya anda kalian yang harus sinkronisasi NPWP sama nik nya, kalian digaji negara untuk apa?"
Pengguna Google,1,2024-01-03 07:43:11,"Dibikin ribet,... Org mau bayar pajak ko dipersulit utk login.... Harusnya cukup masukan no NPWP aja harus langsung auto detect... Org sadar mau bayar pajak susah amat... Ya udalah... UNDELETE sajahhhh....."
Pengguna Google,1,2024-01-03 02:45:37,"Kembangin dulu ni system parah, masa provider 3 gak bisa, yakali harus beli kartu baru buat daftar. Mau dapat otp dari mana eyy. Haaa Indonesia ku 🥰 seperti biasa ngurus apa-apa susah institusi web pemerintah"
Pengguna Google,1,2024-01-02 13:15:12,"Apaan si, nunggu verifikasi SMS seharian juga gada kode masuk, aneh."
Pengguna Google,1,2024-01-02 12:56:36,"Ini aplikasi apaan tak jelas, nampak kualitas sdmnya KKN sehingga hasilnya pun jelek mau sampe kapan negara ini maju kalau pemerintah nya pada korup. Dasar payah gak jelas."
Pengguna Google,1,2024-01-02 12:46:48,"aplikasi gak jelas, password salah terus, tulisan lupa password sebenernya button apa cuma hiasan kok gak bisa dipencet-_-"
Pengguna Google,1,2024-01-02 06:22:34,Susah banget mau daftar aja Nomor otp gk dapet2
Pengguna Google,1,2024-01-02 00:29:19,masyarakat jangan dibuat terlambat mendaftar ataupun memperbaiki data nya dong min...aplikasinya saja tidak dimantenance dgn bagus karena saat memverifikasi untuk efin lupa nomor HP selalu dianggap gagal oleh apknya... tolong perbaiki bug nya...saat mengisi biodata karena lupa EFIN selalu FC terus...
Pengguna Google,1,2024-01-01 14:43:25,ini cara lapor tahunan gimana ya tampilan aplikasi baru kok malah membagongkan
Pengguna Google,1,2024-01-01 12:16:47,Aplikasi bodoh
Pengguna Google,1,2023-12-31 22:01:08,tidak bisa input npwp
Pengguna Google,1,2023-12-31 15:12:59,"Nomor NPWP dan Password sudah sesuai, di web sama aplikasi tidak bisa login, dengan alasan tidak sesuai. Saya ajukan Lupa EFIN tapi sama saja, data ditolak, tidak sesuai. Padahal semua sudah benar dan sesuai. ANEH!"
Pengguna Google,1,2023-12-31 11:39:25,Gagal verifikasi EFIN terus tanpa dkasih tau sebabnya dimana padahal udh sesuai smua. Payah.!!!!!
Pengguna Google,1,2023-12-31 11:00:10,LENAPA GA BISA DI BUKA MENDING HAPUS INI APK GA GUNA
Pengguna Google,1,2023-12-31 07:57:02,Gak bisa apa-apa
Pengguna Google,1,2023-12-31 05:45:08,Verifikasi data selalu gagal.. Aplikasi gagal..
Pengguna Google,1,2023-12-31 00:39:50,"Sudah sulit reg situsnya jelek .....mau daftar di persulit,kalo ada rating nol saya nol dah"
Pengguna Google,1,2023-12-30 21:17:45,"𝐑𝐢𝐛𝐞𝐭,𝐬𝐮𝐬𝐚𝐡,𝐬𝐮𝐥𝐢𝐭 𝐰𝐞𝐥𝐥𝐥 𝐦𝐞𝐧𝐝𝐢𝐧𝐠 𝐮𝐧𝐢𝐧𝐬𝐭𝐚𝐥 𝐚𝐣𝐚"
Pengguna Google,3,2023-12-30 20:53:32,Ok
Pengguna Google,1,2023-12-30 14:13:12,Aplikasi menyedihkan musingin orang awam
Pengguna Google,1,2023-12-30 06:50:49,"Bintang 1 untuk live chat di web dan ribet ,lupa sandi doank di persulit 🖕"
Pengguna Google,1,2023-12-30 06:25:20,Mau login pakai NIK kok digitnya cuma 15?
Pengguna Google,1,2023-12-30 03:34:51,Verifikasi efin gagal terus
Pengguna Google,1,2023-12-30 01:53:21,"Aplikasi yang membagongkan.... Kalau belum punya akun ga bisa akses semua menu, giliran mau daftar pengguna baru malah ga bisa. Tombol Daftar disini ga bisa di klik. Trs gimana mau pake aplikasi ini. Dasar...."
Pengguna Google,1,2023-12-29 14:01:11,"Sudah daftar, gk bisa login, sya daftar gara² creator Udah mintak nik lah kk lah, Huuu entalah malah sudah aku hapus semua nya 🥵"
Pengguna Google,4,2023-12-29 10:59:30,tolong diupdate jenis setoran pajaknya kode 920 dll msh blm ada🙏🙏
Pengguna Google,1,2023-12-29 06:08:42,Semua akan ada pertanggung jawabanya
Pengguna Google,1,2023-12-29 02:14:23,Mohon ditambahkan menu perubahan data jadi memudahkan tanpa perlu datang ke kantor pajak
Pengguna Google,1,2023-12-28 17:10:41,Indonesia lagi butuh orang pintar
Pengguna Google,1,2023-12-28 07:02:22,Aplikasi terburuk di planet ini
Pengguna Google,1,2023-12-28 06:58:33,"aplikasi apa lah ini, bnyk bug nya, buat akun baru ga bisa, kemana devlop nya ini cuy😅"
Pengguna Google,1,2023-12-28 06:11:55,Lupa efin sudah di isi giliran verifikasi muka app terhenti terus gk efisien kalo memang gk bisa gak usah dikasih menu lupa efin
Pengguna Google,1,2023-12-28 04:34:11,"Aplikasi gak jelas. Mau minta permohonan lupa efin tapi verifikasi selalu gagal entah salah dimana. Diulang berkali-kali sama aja. Kalau harus urus ke kantor pajak langsung, ngapain bikin aplikasi sih? Diperbaiki tolong, masa aplikasi pemerintah kayak gini"
Pengguna Google,1,2023-12-28 02:50:23,"Di web bisa dibuka kok, knp diaplikasinya ada yg salah satunya ngga bener password/npwpnyaa!!!"
Pengguna Google,1,2023-12-27 23:11:35,"Gimana ini, stlh masukkan NPWP lupa kata sandi, lalu disuruh masukkan EFIN, pdhl EFIN jg lupa. Ketika masuk melalui menu EFIN krn lupa EFIN dan setelah memasukkan data diri sesuai E-KTP malah Verifikasi Gagal, aneh. Ribet banget sihh"
Pengguna Google,1,2023-12-27 08:17:03,"tidak membantu yang jadi pertanyaan saya buat apa sih ada EFIN segala ? dan ini saya coba untuk ke menu lupa EFIN gak pakai di analisa dulu, langsung gagal padahal tujuan saya download apk ini mau gabungin NPWP dan NIK tapi di persulit, lagian pihak pajak bisa kerja dikit gak sih, kan datanya sudah ada kenapa kita yang harus gabungin gaji tinggi pekerjaan cuman malak"
Pengguna Google,1,2023-12-27 07:30:32,Gimana mau taat dan patuh. Ini mau daftar susah bener. Klau bukan karena pekerjaan. Saya tidak mau repot-repot seperti ini
Pengguna Google,1,2023-12-27 06:37:10,"😅😅 ini suruh masukin nik, sejak kapan nik cuman 15 digit, gimana mau login kalau nik yg bisa di masukan cuman 15"
Pengguna Google,1,2023-12-27 04:53:22,Mau nya gimana sih? Giliran pajak cepat nagihnya di rakyat. Giliran rakyat pakai aplikasi untuk memudahkan malah di persulit. Verifikasi gagal. Sinyal ok. Data valid. Tapi gagal terus. Giliran duit rakyat cepat di potongnya
Pengguna Google,1,2023-12-27 01:38:41,"Gagal verifikasi terus, payah"
Pengguna Google,1,2023-12-26 13:44:52,Aplikasi gk pernah jelas
Pengguna Google,1,2023-12-26 13:43:29,"Anggaran doang digedein, aplikasi sama web sama² butut dan suka eror! 👎🏻 Semoga para koruptor anggaran miskin harta sampe keturunan²nya, dan mati mengenaskan! Aamiin 🤲🏻"
Pengguna Google,1,2023-12-26 09:15:33,Halo admin. Saya sudah isi form lengkap untuk mendapatkan npwp pribadi namun sampai kini tidak ada kelanjutan. Saya coba login app disuruh nik/npwp. Lalu saya coba isi nik saja. Namun kolom isian Mash kurang lengkap 1 digit. Aneh banget app milik negara kok seperti ini. Erroor atau kurang biaya Tah?
Pengguna Google,1,2023-12-26 07:22:30,"Gak jelas, sudah diisi gakbisa pencet apapun"
Pengguna Google,1,2023-12-26 05:41:28,Biaya untuk sistem nya dikorupsi. Aplikasi babi
Pengguna Google,1,2023-12-25 13:43:54,"mungkin tahap uji coba, makanya gagal terus. 🤭"
Pengguna Google,2,2023-12-25 13:12:35,Knapa salah terus password nya idpadahaldah bner
Pengguna Google,1,2023-12-25 12:06:57,Buruk
Pengguna Google,1,2023-12-25 09:30:16,"Kalo kata Rocky Gerung, ini aplikasi DUNGU! Tim IT nya suruh pindah posisi aja jadi admin gudang, yg cuma ngedata barang keluar masuk kalo gak becus jadi IT!"
Pengguna Google,1,2023-12-24 22:17:11,"Sdh dipadankan nik & NPWP, pas m masuk ke aplikasinya koq ngga bisa?? Aplikasi ngga jelas"
Pengguna Google,1,2023-12-24 15:09:01,"Aplikasi ga ada manfaatnya, buat nulis nik aja kolom ga cukup. Yang bikin bocah magang kali"
Pengguna Google,1,2023-12-24 14:51:35,Parah banget gak bisa masuk
Pengguna Google,1,2023-12-24 10:26:10,"Sulit banget,kalo mau secara online ya jangan dipersulit loginnya."
Pengguna Google,1,2023-12-24 04:11:53,Suruh orang bayar pajak tpi apknya lemot udh di coba di hp sama laptop tetep lemot gajelas orang pajak emang
Pengguna Google,1,2023-12-23 14:00:53,"Saran aja ini ya, buat aplikasi ga usah muluk muluk. Kalian buat login harus memakai captcha tapi captcha ga keluar. Punya aplikasi itu di urusi Jagan buat asal jadi terus di biarkan"
Pengguna Google,1,2023-12-23 01:25:53,"Setiap sampai kode verifikasi sms tidak pernah masuk nyoba sampek puluhan kali ,gimana sih ini ? Percuma di update ,mau taat pajak saja susah nya minta ampun🤦"
Pengguna Google,1,2023-12-22 11:18:56,"Ribet jga yaa, pdhal mau laporan pajak"
Pengguna Google,1,2023-12-22 09:19:24,Aplikasi buat habisin anggaran..bobrok..sebobrok moral pejabat konoha..yg penting..cuan..cuan..cuan..
Pengguna Google,1,2023-12-22 05:22:29,Aku daftar NPWP pribadi buat kerja kok susah ya? Sebentar kantor offline yg menangani masalah ini dimana sih?
Pengguna Google,1,2023-12-22 04:13:09,JOKOWI SDH KELAMAAN MENJABAT HARUS DIGANTI PARTAI LAIN.SISTEM BOBROK.MAU MINTA EFIN AJA DIPERSULIT.NEGARA ANJIHINGGGG
Pengguna Google,2,2023-12-22 02:38:03,Gimana mau ambil foto kalau keluar sendiri
Pengguna Google,1,2023-12-21 19:17:38,Loe olang memang PANTAS.. Memang pantas untuk OE HANTAM 👩‍🦲👊👊👊 baru bikin akun sudah keblokir... phei phei phei
Pengguna Google,1,2023-12-21 19:11:52,"Aplikasi gak jelas, mau login gak bisa, karakter limit utk NPWP/NIK. Selalu gagal login karena NPWP/NIK tidak bisa ditulis dengan lengkap,, wkwkwk anehh anehh"
Pengguna Google,1,2023-12-21 17:57:43,"Kns veripikasi nyari no efin gagal terus sih ,jelek banget aplikasinya"
Pengguna Google,1,2023-12-21 12:28:45,"Kecewa berat susah buat daftar online, bufering ujung ujung nya link nya ilang gak terjangkau lagi, 2 x coba masih sama,"
Pengguna Google,1,2023-12-21 12:12:41,"Apk/webnya gak jelas mau daftar bikin npwp kga bisa bisa ribet pula, fungsinya serba online itu mempermudah bukan mempersulit, developernya ngambil dari mana kali sekelas bumn loh ini!"
Pengguna Google,1,2023-12-21 11:05:02,"Jelek x pecat aja yang buat. Ganti aja slogannya . ""Pajak kita untuk kami"""
Pengguna Google,1,2023-12-21 08:30:42,Aplikasi bosok jlek gak guna mau masuk salah pasword & salh NPWP bodoh bngt yg bikin ini web hrus di abtude yg lbh bgus
Pengguna Google,1,2023-12-21 07:28:08,Jelek
Pengguna Google,5,2023-12-21 01:53:42,Bagus
Pengguna Google,1,2023-12-20 08:14:04,"Aplikasi pajangan doang fitur nggak bisa apa2, kata mau era digital pemerintah buat aplikasi begitu aja ribet"
Pengguna Google,1,2023-12-20 03:11:43,"Untuk saat ini belum bisa dikatakan bermanfaat. Login pake NIK, kotak ga cukup, kurang 1 angka. Pake NPWP, password salah terus. Klik lupa password, apk cuma diam ga respon apa2. Trus ni apk buat apa? Belum siap kenapa dilaunching, servernya aman ga nih? Kenapa lagi2 aplikasi punya pemerintah selalu bermasalah? Kalah dgn aplikasi swasta. IT-nya gimana nih?"
Pengguna Google,1,2023-12-20 03:08:22,"Apps tidak guna,lupa efin verifikasi gagal terus.lol"
Pengguna Google,3,2023-12-20 01:42:15,"untuk masuk akun pakai NIK masih blm bisa, 1 digit terakhir nik tidak bisa masuk. Mohon segera perbaikannya, demi kenyamanan bersama. terimakasih"
Pengguna Google,1,2023-12-19 20:39:31,Sebenarnya pengen menghina habis-habisan untuk app ini...
Pengguna Google,1,2023-12-19 12:27:46,"gagak jelas,minta lupa EFIN melalui M-PAJAK VERIFIKASI GAGAL TERUS,PAYAH"
Pengguna Google,1,2023-12-19 11:29:26,"Ini apa apaan sih, tolonglah yang jelas kalo bikin apk. Yakali gabisa buat sign in ?"
Pengguna Google,1,2023-12-19 08:04:26,"Apa gunannya pemerintah bikin aplikasi online, kalo mau ngurus efin keterangan di web di arahkan di aplikasi, di aplikasi gagal terus, lewat telpon 1500200, malah di arahkan ke KPP langsung,"
Pengguna Google,2,2023-12-19 06:48:11,Lewat website bisa login tapi kenapa lewat aplikasi malah ga bisa hmm
Pengguna Google,1,2023-12-19 03:15:40,"Tujuan nginstal buat lupa efin, giluran mw request lupa efin malah error melulu"
Pengguna Google,1,2023-12-19 02:31:59,"Payah mau minta EFIN. Udah pengajuan detil pengisiannya dicoba berulangkali tetap aja Gagal ferifikasi ..Aneh! Ini system pemerintah tapi aplikasinya payah bgt, lalu kerja kalian apa? Kukira dipermudah ternyata diPERSULIT!"
Pengguna Google,5,2023-12-19 01:37:43,Bagus
Pengguna Google,1,2023-12-19 00:39:04,Login pake nik tapi angkanya ga cukup..
Pengguna Google,1,2023-12-18 16:13:15,Banyak yang ngeluh tapi dari pihak app nggak ada yang ngerespon 🙆🤦🏼‍♂️🤦🏼‍♂️🤦🏼‍♂️
Pengguna Google,1,2023-12-18 13:54:22,Emang ada aplikasi atau Web pemerintah yg lancar.???
Pengguna Google,1,2023-12-18 08:31:10,email aktivasi gak pernah dikirim
Pengguna Google,1,2023-12-18 07:47:03,Cacat
Pengguna Google,1,2023-12-18 05:46:22,Aplikasi edan. Makan uang rakyat tapi bikin aplikasi nya ga becus
Pengguna Google,1,2023-12-18 04:44:18,Baru buka udah eror
Pengguna Google,5,2023-12-18 04:18:43,Sangat membantu bikin darah tinggi dan emosi. Masyarakat di suruh digitalisasi sistem tapi pelaksanaan pelayanan untuk masyarakat sangat mengecewakan sangat buruk di berbagai bidang termasuk ini wajib pajak wajib pajak tapi menyulitkan ribet
Pengguna Google,1,2023-12-18 03:52:56,"Aplikasi karya anak bangsa, server kentang proyék selangit🤣"
Pengguna Google,1,2023-12-18 03:52:47,"Tolong lah buat pemerintah aturan dan layanan di sesuaikan jangan hanya aturan saja yg di tingkatkan tapi pelayanan buruk , aplikasi pajak kok seperti aplikasi sampah di buka selalu Erorr 👎"
Pengguna Google,1,2023-12-18 03:18:30,Error mulu
Pengguna Google,1,2023-12-18 02:50:30,"Parah banget, ngga bisa di buka aplikasinya. Mau regis lewat web juga ngga masuk otp ke nomor saya."
Pengguna Google,1,2023-12-18 01:37:05,Pemerintah ini gmna ya. Padahal kan jg uang pajak banyak. Masak aplikasi Website nya g jelas gini. Kan harusnya pelayan di bagusin ya. Berapa sih buat Website dan aplikasi yg bagus. Bukan korupsi nya d gedein.
Pengguna Google,1,2023-12-16 14:30:56,"Aplikasi pemerintah yang sangat jelek, tidak bisa memasukan NIK 16 angka, pemerintah bodoh"
Pengguna Google,1,2023-12-16 11:31:30,Pake developer mana nih... Luar biasa
Pengguna Google,4,2023-12-15 23:26:33,Mantap
Pengguna Google,1,2023-12-15 21:21:41,Tidak perlu
Pengguna Google,1,2023-12-15 09:40:44,aplikasi masih cacad udah di release. 🥲
Pengguna Google,2,2023-12-15 07:43:06,Di download mening lama bgt geraknya padahal sinyal bagus....bikin peraturan buat umum tp pas mau perbaikan via online malah susah..
Pengguna Google,1,2023-12-15 05:31:00,Ini mau daftar baru kenapa baru mau isi email yg aktif kolomnya harus huruf kapital semua anjir
Pengguna Google,1,2023-12-15 04:38:55,Ribet.
Pengguna Google,1,2023-12-15 03:57:19,APK gagal untuk Submit NIK tidak bisa. Dikarenakan Submit di batasi
Pengguna Google,1,2023-12-15 03:22:18,"Aplikasi pemerintah emang selalu gagal😓 Udah lebih dari 5 kali ngirim OTP, udah ditunggu lama tapi gak masuk masuk. Percuma ada aplikasi kalo emang masih bikin ribet."
Pengguna Google,1,2023-12-14 23:54:09,"Lupa efin, isi data selalu gagal, solusinya di suruh ke kantor. Guna aplikasi ini untuk apa?"
Pengguna Google,1,2023-12-14 13:05:29,"Mau login padahal udah bener akun sama password, nulis kode keamanan juga bener masih aja di bilang salah kode. Mau login doank di persulit. Benerin itu website nya!"
Pengguna Google,1,2023-12-14 10:14:13,"aplikasi gak guna, aplikasi pemerintah kagak ada yg bener, input nik max cuman bsa 15 digit, ya jelas gak bsa login, error trs..ngaco emng"
Pengguna Google,1,2023-12-14 06:33:41,"Mau Daftar ribet banget, ngabisin pulsa doang berkali2, masa iya rapcha udh di ketik bener masih salah trus."
Pengguna Google,1,2023-12-14 03:57:46,"aplikasi ngaco, mohon diperbaiki jangan hanya minta uangnya saja"
Pengguna Google,1,2023-12-14 03:51:40,Ribet bikin bingung
Pengguna Google,1,2023-12-14 02:38:08,ini saya buat efin tapi kok sampe sekarang belum di kirim ya email nya
Pengguna Google,1,2023-12-14 02:16:37,Ga jelas. Susah d klik aneh
Pengguna Google,1,2023-12-14 00:16:43,"Login pakai NIK KTP tapi yg bisa di ketik cuma 15 angka, 😆 gk bisa dipake app nya"
Pengguna Google,1,2023-12-13 22:26:24,"Kok mau lapor dan bayar pajak malah di persulit dgn aplikasi yg tdk berfungsi, beberapa bulan ini selalu bermasalah"
Pengguna Google,5,2023-12-13 14:22:00,Kerenn
Pengguna Google,1,2023-12-13 11:22:43,"Ini tempat pelaporanya gak ada yang jelas.kita punya pertanyaan gak ada tempat buat pengaduannya,..aplikasi online tapi kaya offline"
Pengguna Google,1,2023-12-13 09:46:26,Data dah bener semua masa salah 🤦
Pengguna Google,1,2023-12-13 09:18:42,"Aplikasi aneh, daftar gak bisa lupa sandi pun gak bisa di klik"
Pengguna Google,1,2023-12-13 06:30:01,"Sumpah ribet gak memudahkan malah bikin pusing. Efin lupa, mau ngurus ribet, gak di urus tapi penting. Kenapa sih selalu di persulit"
Pengguna Google,1,2023-12-13 06:24:44,"Masa NIK NPWP kan 16 nomor tapi pas mau login maksimal 15 karakter yg bisa diketik, gimana loginnya?"
Pengguna Google,1,2023-12-13 05:58:53,Parah pokoknya..
Pengguna Google,5,2023-12-13 02:26:50,Luar biasa
Pengguna Google,1,2023-12-13 01:20:16,"Ku pikir d permudah rupanya sama saja, Sudah input data 3 kali masih tidak valid, padahal sistemnya yang otomatis isi."
Pengguna Google,1,2023-12-13 00:34:52,Klik lupa pasword ga bisa. Gmana nih yg buat aplikasinya?
Pengguna Google,1,2023-12-12 14:03:29,Tidak bisa login nomor NPWP maupun NIK karena kolom angka kurang satu. Aplikasi aneh
Pengguna Google,1,2023-12-12 12:56:22,Developer nya siapa sih masa g bisa login pk nik KTP (maks 15 angka)
Pengguna Google,5,2023-12-12 10:01:51,Gak bisa login ini gimana NPWP
Pengguna Google,1,2023-12-12 05:55:30,"Aplikasi gak jelas, suruh masukkan nik/npwp giliran di ketik ga bisa sampe full, npwp nomernya banyak lebih dari 16 dan ada tanda titik,sambung, tapi di aplikasi gak bisa ngetik angka lebih dari 15, trus gimana???? alhasil ngetik nik cuma 15 angka, dan ada notifikasi error mendapatkan npwp😡😡😡"
Pengguna Google,5,2023-12-12 03:55:59,Ok
Pengguna Google,1,2023-12-12 03:26:56,Masuk pale nik masa kurang 1 digit.... Gimana mau bener. Pasti salah terus lah
Pengguna Google,1,2023-12-12 03:04:05,Tidak bisa login dengan NIK
Pengguna Google,1,2023-12-12 02:15:05,"Niat kerja gk sih ini dev nya, masukkan nik dan npwp gk bisa full digit ya gmn mau login Pemerintah klau ngerekrut pegawai jgn main² lah, masa bikin aplikasi modelnya kyak gini, habis aja uang negara buat gaji org² gk jelas dan gk kompeten"
Pengguna Google,1,2023-12-12 01:09:44,"benerin lagi dl aplikasinya eror""eror mulu"
Pengguna Google,1,2023-12-11 15:12:24,parah verif efin gagal mulu salah mulu padahal udah sesuai ktp percuma
Pengguna Google,1,2023-12-11 13:40:47,Aplikasi miskin menu
Pengguna Google,1,2023-12-11 13:37:47,Lemot gilak
Pengguna Google,2,2023-12-11 12:39:08,Ini aplikasi gimana sih ..kode verifikasi lewat SMS GK sampai sampai
Pengguna Google,1,2023-12-11 10:40:29,Ribet banget sumpah nyusahin orang.
Pengguna Google,1,2023-12-11 10:33:09,Tidak membantu sama sekali. Hapus aja
Pengguna Google,1,2023-12-11 10:22:06,"Lupa E-FIN dan sudah masukkan data dengan benar tapi pas submit data ada notif error ""verifikasi gagal"" tidak bisa mengirim data. Kapan diperbaiki aplikasinya??"
Pengguna Google,1,2023-12-11 08:52:55,"Error validate ktp, maunya apa"
Pengguna Google,1,2023-12-11 07:05:41,"Yakali pak, id udah bener, pasword udh bener. Masih aja gk bisa masuk karena salah pasword."
Pengguna Google,5,2023-12-11 02:50:35,Sangat bermanfaat
Pengguna Google,1,2023-12-11 01:39:59,gk heran klo app yg dikelola pemerintah
Pengguna Google,2,2023-12-11 00:16:46,"ribet sekali hanya untuk daftar npwp. Pergi ke dinas setempat disuruh daftar lewat app, sungguh membingungkan."
Pengguna Google,1,2023-12-10 23:12:58,Aplikasi ga jelas minta efin ajh susah bnget .. pdhal data bner foto selfi jga bner smbil bawa ktp npwp .. perbaiki lah
Pengguna Google,2,2023-12-10 17:46:01,"yailah untuk daftar aja sulit stengah gila,masih ala2 online.jelas dri dlu klw pke online slalu bermslah dan gk berkembang alias nyaman dngan lemotnya sistem yg tdk di perbaharui. please lah klw mau pke sistim online2 perbaiki sistem nya,masa bgini mau dibilng maju.kapan..?"
Pengguna Google,2,2023-12-10 15:17:45,"""Tombol"" Buat kode billing ndak aktif terus... 🤦 tolooong!!!!"
Pengguna Google,1,2023-12-10 11:47:12,"Wah aneh nih aplikasi,, mau login pakai NIK eh malah digitnya nggak cukup, pakai NPWP juga kagak bisa masuk,, 👎👎👎"
